{
  "content": {
    "kind": "text",
    "text": "用户偏好简洁的代码审查意见"
  },
  "metadata": {
    "core": {
      "schema": "patchouli.knowledge@1",
      "scope": {
        "tenant": null,
        "workspace": "patchouli",
        "user": "user-42",
        "session": null
      },
      "origin": {
        "provider": "local",
        "binding": "deepseek-harness",
        "native_type": "message",
        "native_id": "message-9",
        "native_revision": null
      },
      "time": {
        "event_at": "2026-08-14T08:00:00Z",
        "source_created_at": "2026-08-14T08:00:00Z",
        "source_updated_at": null,
        "observed_at": "2026-08-14T08:00:01Z",
        "ingested_at": "2026-08-14T08:00:02Z"
      },
      "lifecycle": {
        "status": "active",
        "expires_at": null
      },
      "provenance": [
        {
          "kind": "observed",
          "actor": "plugin:patchouli",
          "source": "message:message-9",
          "recorded_at": "2026-08-14T08:00:01Z"
        }
      ]
    },
    "extensions": {
      "local.session": {
        "turn": 18,
        "sequence": 4
      }
    }
  },
  "artifact": [
    {
      "ref": "artifact:embedding-1",
      "role": "embedding",
      "media_type": "application/vnd.patchouli.embedding",
      "digest": "sha256:0123456789abcdef",
      "metadata": {
        "model": "embedding-model-a",
        "dimensions": 1536,
        "metric": "cosine",
        "source_version": "v3"
      }
    }
  ],
  "profile": {
    "epistemic": "observation",
    "temporal": { "kind": "timeless" },
    "ownership": "user",
    "abstraction": "pattern",
    "persistence": "long_term",
    "retrieval": ["exact", "associative"],
    "actionability": "informational"
  }
}
